{
  "name": "tooltip",
  "description": "A hover/focus tooltip: add data-tooltip=\"...\" directly onto any real element to give it one, no wrapper markup required. E.g. explaining why a disabled Undo button is disabled.",
  "status": "stable",
  "category": "toasters",
  "variants": [],
  "props": [
    {
      "name": "text",
      "type": "string",
      "required": true,
      "description": "The tooltip's text. In real usage this is the data-tooltip attribute value on the actual trigger element (a button, an icon span, etc.) -- not a separate component instance."
    },
    {
      "name": "label",
      "type": "string",
      "required": false,
      "description": "Only used by this component's own demo trigger (template.html): the visible content of the illustrative element data-tooltip is attached to. In real use, data-tooltip goes on an element the page already has; this prop has no meaning there."
    },
    {
      "name": "preview",
      "type": "string",
      "required": false,
      "default": null,
      "description": "visible: data-preview=\"visible\" on the [data-tooltip] element shows the tooltip without hover/focus. Documentation only (the site's Toasters and tooltips card); never in product UI."
    }
  ],
  "source": "none",
  "rationale": "Styled to Figma D_SYSTEM's Tooltip (node 103:4777): a dark fill (tooltip-bg, Figma base/900), a 1px tooltip-border, white body text, 10px padding, no shadow -- dark so it reads as a layer above the page in either theme. Pure CSS, no JavaScript: content: attr(data-tooltip) reads the trigger's own attribute, and :hover / :focus-visible are the whole show condition, because a tooltip's dismissal is exactly 'stop hovering or focusing'. Adding JS (as popup and dropdown-menu need for their open state) would be complexity with no functional gain. Figma's text+icon variant is not implemented: the bubble is the host's ::after, and a host's ::before is already taken (text-button's hover brackets), so there is no free box for an icon. Known limitation: no viewport clamping, so a trigger near a container edge can render the bubble partly off-screen. Rendering verified in light and dark themes.",
  "themes_supported": [
    "light",
    "dark"
  ],
  "a11y_notes": ":focus-visible (not just :hover) shows the tooltip, so keyboard users reach it with Tab. The tooltip text is CSS generated content and is not announced as a description; if it must be announced, the host should add aria-describedby pointing at a real, visually hidden text node. A native <button disabled> can't receive focus, so a tooltip on a disabled button is mouse-only; to make it keyboard-reachable, the host would use aria-disabled on a still-focusable button instead of the disabled attribute."
}
