{
  "name": "table-row",
  "description": "One row of a queue table: a horizontal composition of table-cell instances (checkbox-cell, text cells, status, date, icon-cell, row actions), with a selected state toggled by clicking the row's own checkbox. table-row defines no cell content itself -- it is a flex container that composes table-cell. The demo shows every row Type of the Penpot source with its real cell composition and order, plus a block of rows stacked together with a header row.",
  "status": "stable",
  "category": "tables",
  "layout": "wide",
  "variants": [
    "default",
    "selected"
  ],
  "props": [
    {
      "name": "selected",
      "type": "boolean",
      "required": false,
      "default": false,
      "description": "Whether the row is selected (Penpot's State axis, Default / Selected): its cells fill bg.surface-pressed and its checkbox shows the checked icon, both by CSS off this attribute. Toggled only by clicking the row's own checkbox (component.js)."
    },
    {
      "name": "status",
      "type": "string",
      "required": false,
      "description": "Optional data-status on the row (analysed / submitted / approved / pending / declined): style.css colors the value of the row's dropdown-type cell as a status pill from the row-status tokens. Other values, or none, leave it plain."
    },
    {
      "name": "flash",
      "type": "string",
      "required": false,
      "description": "Optional data-flash=\"success\" on the row: its cells fade from system-success back to their own fill once, over three seconds (a result just landed). The host sets it and removes it on animationend; no animation under prefers-reduced-motion. The green starts weaker in the dark theme."
    },
    {
      "name": "extra_attrs",
      "type": "string",
      "required": false,
      "description": "Raw attribute passthrough on the row element (e.g. a data-* identifier the host page reads back). Same contract as text-button's extra_attrs: the host passes only trusted, pre-escaped markup."
    },
    {
      "name": "href",
      "type": "string",
      "required": false,
      "default": null,
      "description": "data-href on the row: a click anywhere in the row that is not on a control opens this URL (component.js). Keep a link cell in the row for keyboard and middle-click. Before navigating, a cancelable ds-table-row-open { href } event is dispatched on the row; preventDefault() keeps the page (a host opening the row in place)."
    },
    {
      "name": "cells",
      "type": "array",
      "required": false,
      "default": null,
      "description": "Cell dicts passed to table-cell. Keys passed through: type, content, icons, secondary_label, input_value, href, single_icon, single_icon_label, priority, checkbox_role, options, dropdown_label, view_label, tag_type, tag_subtype, article, plain, mark, mark_label, highlight, wrap, submit, extra_attrs, secondary_extra_attrs, tertiary_label, tertiary_extra_attrs."
    },
    {
      "name": "action-row",
      "type": "boolean",
      "required": false,
      "description": "data-action-row on a row-like element (display:contents, not a .ds-table-row) whose whole width is one action: row hover fill and the pointer; the host makes a click on it press its button."
    },
    {
      "name": "visited",
      "type": "boolean",
      "required": false,
      "description": "data-visited=\"true\": the viewer has already acted on this row; its cells take bg-row-visited."
    }
  ],
  "source": "penpot:28cec651-3f14-8022-8008-8c9a0bd68c76",
  "rationale": "Only Penpot's State axis (Default | Selected) is a style variant. Its other axes -- Type (Checkbox only, Analysed, Found, Archived, Submitted, Empty State, Collection, Check + Button, Snippet) and Comment -- only change which table-cells are composed, never the row's own CSS, so they are demo compositions, not props (as header-block treats its Type axis). Each Type's composition was read off its Penpot instance by x-position, not DOM order: Penpot authors rows in row-reverse with actions first, and this component uses plain left-to-right order, which renders the same and keeps the source readable. Penpot's \"Analysed2\" appears to be a leftover duplicate and is not demoed; the second, unlabeled checkbox of \"Check + Button\" is reproduced as it is, with no invented purpose.\n\nLayout (Figma flat table): the row is a flex container with align-items: stretch, so every cell is as tall as the tallest, like a real table row. Hover, focus-within and selected fills go on the cells, not the row, because hosts often lay rows out as display:contents inside a grid (so columns align across rows), and a display:contents element paints nothing. Selected is bg.surface-pressed; data-selected-fill=\"strong\" on the table container uses the darker base/250 (Figma screen 25). Checkbox and save icons show only on hover, focus, selected or saved (the header row always shows them), and data-reveal-actions on the container dims row actions to 40% until hover or keyboard focus, so a long table reads as data first. A row's data-status colors its Status dropdown's value as a pill in the row-status tokens.\n\nSelection: only a click on the row's own checkbox (a checkbox-cell containing [data-icon=\"checkbox\"], so a drag handle in the same cell type is excluded) toggles data-selected; the checked icon swaps in by CSS. Shift+click selects the range from the last clicked row in the same table (visible rows in DOM order, so it follows sorting and skips rows hidden by a search), as one ds-table-row-select event with detail.range = true. A [data-checkbox-group] container may hold one select-all header cell (table-cell checkbox_role=\"select-all\"), whose checked / semi / unchecked state follows how many rows are selected; clicking it selects all unless all are selected.\n\nReordering: a checkbox-cell holding Penpot's \"Drag\" glyph is a reorder handle. The row's own script uses native drag and drop, started only from the handle (draggable sits on the handle, which has a box even when the row is display:contents); dragover moves the row before or after the sibling under the pointer, measured on the sibling's first cell, and the dragged row's cells dim to 0.5 -- motion only as feedback. Hosts can drive their own drag and drop instead: data-dragging=\"true\" dims a row, data-drop=\"before\"/\"after\" draws an accent line on its top or bottom edge, and the whole handle cell shows the grab cursor. Not sourced from the design: selection, range selection, select-all and reordering. Rendering verified in light and dark themes. The `cells` list passes each cell's own props through to table-cell: type, content, icons, secondary_label, input_value, href, single_icon, single_icon_label, priority, checkbox_role, options, dropdown_label, view_label, tag_type, tag_subtype and article. Additions 2026-10-23: href makes the whole row a mouse target (pointer cursor on every cell), skipping clicks on controls, with modifier keys or while selecting text; the row-select checkbox cell is focusable (role=checkbox, aria-checked following data-selected) and toggles with Space / Enter through the same click path, with an accent focus outline. Cells now receive submit / extra_attrs and the other action props, so a host no longer builds action rows by hand. Action row (explicit request 2026-10-24): a table's one-action row (Add Project) answers hover like a row and shows the pointer, so the whole row is the target, not only its button. Visited (data-visited=\"true\", explicit request 2026-10-24): a row the viewer has already acted on gets the faint bg-row-visited on its cells, lighter than hover, so touched and untouched rows tell apart; hover and selected still win. The host decides what marks a row and for how long; light only until a dark value exists. Current (data-current=\"true\", explicit request 2026-10-25): the host marks the row of what it shows elsewhere right now (the project under the reader's eye in a preview beside the table); only its fill, one step lighter than hover (bg-row-current), tells it; icons and actions stay as on any row.",
  "themes_supported": [
    "light",
    "dark"
  ],
  "uses": [
    "table-cell"
  ],
  "a11y_notes": "Selection listens only on the row's checkbox cell, so clicks on other cells and their controls never collide with it. No row roles are added (role=\"row\", aria-selected), since the system doesn't wrap rows in a role=\"table\" structure; a host adds them at table level. Known gaps: the row checkbox and the select-all control are role=\"img\" icons with aria-labels (\"Select row\", \"Select all rows\"), not real checkboxes, so their checked / mixed state isn't announced, and Shift+click range selection has no keyboard equivalent. The drag handle has aria-label=\"Reorder\", but native drag and drop is pointer-only; an accessible reorder needs a keyboard path (e.g. arrow keys on the focused handle with a live announcement), not implemented. The second checkbox of \"Check + Button\" is labeled plainly \"Checkbox\". 2026-10-23: the checkbox cell is keyboard operable (Tab, Space, Enter) with aria-checked; a row href is only a larger mouse target, the link cell stays the keyboard path."
}
