{
  "name": "text-button",
  "description": "An unfilled, text-only action control whose color shows the status of the operation behind it (active / loading / confirmed / disabled / error) rather than pointer emphasis -- used where a label must show an async action moving from in-progress to done (e.g. an inline row action). A permanent solid or dotted underline marks it as clickable and says whether the click leaves the page; hover and keyboard focus add '[ ]' brackets.",
  "status": "stable",
  "category": "buttons",
  "variants": [
    "primary",
    "secondary"
  ],
  "props": [
    {
      "name": "priority",
      "type": "string",
      "required": true,
      "default": "primary",
      "description": "primary (bold typography.buttonPrimary) or secondary (regular typography.buttonSecondary)."
    },
    {
      "name": "status",
      "type": "string",
      "required": false,
      "default": "active",
      "description": "active, loading, disabled, confirmed, or error. status=active, error and disabled carry the permanent underline (see `underline` prop; disabled draws it in the disabled color, Figma D_SYSTEM node 132:4987) -- loading/confirmed are not pointer-interactive states and carry none. error is a destructive-action confirmation state, not a disabled one."
    },
    {
      "name": "underline",
      "type": "string",
      "required": true,
      "default": "solid",
      "description": "solid or dotted -- the permanent underline drawn under the label for status=active, error and disabled: solid when the action navigates to a new page/URL, dotted when it stays within the current view (opens/closes a popup, loads more rows, expands a section). Chosen per instance by what the action does, not by eye (CLAUDE.md, Interaction conventions)."
    },
    {
      "name": "icon",
      "type": "string",
      "required": false,
      "default": null,
      "description": "Optional icon name (an icons/<name>.svg file), rendered in a `.ds-text-button__icon` span next to a `.ds-text-button__label` span, spacing-button-gap (5px) apart. The icon has no color of its own: it inherits the status color. Omit for a plain text button."
    },
    {
      "name": "unread",
      "type": "boolean",
      "required": false,
      "default": false,
      "description": "data-unread=\"true\": something new behind the button; secondary accent color."
    },
    {
      "name": "icon_position",
      "type": "string",
      "required": false,
      "default": "left",
      "description": "left or right: where `icon` sits relative to the label (Figma D_SYSTEM Button Type=Text+L-icon / Text+R-icon). right renders the label span first and sets data-icon-position=\"right\". Ignored without `icon`."
    },
    {
      "name": "icon_only",
      "type": "boolean",
      "required": false,
      "default": false,
      "description": "Render only `icon`, no visible label (Figma Type=Icon / icon-outlined). `label` becomes the button's aria-label and title and is required -- template.html fails the compose if it or `icon` is missing. data-icon-only=\"true\"; 10px sides, 8px top/bottom (24px icon in Figma's 44x40 box)."
    },
    {
      "name": "outlined",
      "type": "boolean",
      "required": false,
      "default": false,
      "description": "1px object-dark-passive border around the button (Figma Type=text-outlined / icon-outlined), taken out of the padding so an outlined button's outer box matches the plain one. data-outlined=\"true\"."
    },
    {
      "name": "preview",
      "type": "string",
      "required": false,
      "default": null,
      "description": "hover: render the hover look (brackets, outlined accent border) without a pointer, via data-preview=\"hover\". Documentation only -- for pages that lay every state side by side (Figma D_SYSTEM node 132:4987); never set it in product UI."
    },
    {
      "name": "submit",
      "type": "boolean",
      "required": false,
      "default": false,
      "description": "Renders type=\"submit\" so the button submits its enclosing form; otherwise type=\"button\"."
    },
    {
      "name": "href",
      "type": "string",
      "required": false,
      "description": "Renders an <a href> (through safe_url) instead of a <button>, for navigation. A disabled link has no href and carries aria-disabled."
    },
    {
      "name": "article",
      "type": "string",
      "required": false,
      "description": "der | die | das: tints an active label by grammatical gender (der keeps accent-1, die row-status-declined-text, das row-status-approved-text). Other values are ignored; only the active status is affected."
    }
  ],
  "source": "penpot:28cec651-3f14-8022-8008-8c9a0bb4dc55",
  "rationale": "Two independent axes, each carried by exactly one property so neither can be misread as the other. Priority changes only typography (typography.buttonPrimary bold vs buttonSecondary regular). Status changes only color, reusing the design's own status vocabulary: active = accent-1 (the one interactive color), loading = system.warning, confirmed = system.success, disabled = object-dark.active, error = system.error-strong where a theme defines it, falling back to system.error. error is a destructive-action confirmation step (e.g. gallery's 'Reset selection' arms a second click): the button is still clickable, the color says what the next click does. The Penpot source's tertiary priority was dropped: it was only partly defined.\n\nUnderline: permanent, not hover-only, because the design draws it at rest. It means 'clickable', so it is drawn for active and error; disabled keeps it in the disabled color so the control still says what it would do while the color says it can't; loading and confirmed are not clickable and carry none. solid vs dotted follows the system-wide convention (solid leaves the page, dotted stays in the view; see CLAUDE.md, Interaction conventions). Solid is 1px (border-width-thin) so it doesn't turn into a bar under bold labels; dotted is 2px (border-width-default) because dot size follows thickness and 1px dots read as specks. The underline sits on an inner span (.ds-text-button__text, added by component.js for bare-text buttons, or .ds-text-button__label) because a browser paints an ancestor's text-decoration across its whole content box, which would include the bracket space.\n\nBrackets: hover and keyboard focus reveal '[ ]' around the label -- the affordance the Penpot source drew on every instance, kept as an interaction cue only. They are always rendered but transparent at rest, so revealing them changes color only and the button never changes width. In tight contexts (header-block rows, sidebar set rows, action/link table cells, page-head, pane and popup-step heads, block-row actions, icon-only buttons) the brackets hang inside the horizontal padding instead of reserving space, so the button hugs its label and neighbours never shift. Outlined buttons show no brackets: their border turns accent-1 on hover and focus instead, the border already being the control's edge.\n\nBox: no fill, no shadow, radius none -- the control is text and color already carries every state. Padding is spacing-cell (10px) vertical / spacing-button-x (11px) horizontal and the icon/bracket gap spacing-button-gap (5px), the figures Figma uses on every button, nav link and table action. Outlined adds the object-dark-passive hairline tables and cards already use, taken out of the padding so an outlined button's outer box matches a plain one. Icon-only buttons pad 8px top/bottom (spacing-3) and 10px sides (spacing-cell) around a 24px (spacing-7) glyph, the size used for standalone glyphs elsewhere.\n\nIcons have no color of their own and inherit the status color, so they track every status without per-status rules; glyphs are inlined via fetch (see component.js) so currentColor applies. unread (accent-2, the nav dot's color) marks that something new is behind the button. preview='hover' draws the hover look statically, for documentation pages only. In dark, system.warning is yellow.600, so loading stays distinct from active. Rendering verified in light and dark themes.",
  "themes_supported": [
    "light",
    "dark"
  ],
  "a11y_notes": "Renders as a native <button>. status=disabled also sets the native disabled attribute, since the action is genuinely unavailable. status=loading stays focusable; a host that wants it inert while loading must also set disabled. The permanent underline is supplementary (color already distinguishes the statuses), so forced-colors modes that strip text-decoration remove no information. Icon variants keep .ds-text-button__icon aria-hidden=\"true\": the label already supplies the full accessible name. The hover / focus brackets are CSS-generated ::before/::after content; browsers differ on whether generated content enters the accessible name, so the name never depends on it -- the button's own text is unchanged by hover or focus. Brackets also appear on :focus-visible, so keyboard users get the same affordance as a mouse hover."
}
